{
  "eventId": "84000000-0000-4000-8000-000000000003",
  "sequenceNumber": 2,
  "occurredAt": "2026-01-01T00:11:00Z",
  "action": "feedback.submit",
  "outcome": "succeeded",
  "actor": {
    "subjectId": "7960befad07fdd60ae0edea6f19a4f629f5e714526db35421602c9ffcfb10b4e",
    "subjectHashSaltId": "conformance-deployment-v1",
    "actorType": "agent",
    "authenticationMethod": "signed-token",
    "delegatedBySubjectId": null
  },
  "authorization": {
    "scopeId": "authorized-assets",
    "decision": "allowed",
    "requiredPermissions": ["evidence.review"],
    "grantedPermissions": ["evidence.review"],
    "reasonCode": null
  },
  "correlationId": "84000000-0000-4000-8000-000000000004",
  "traceId": "cccccccccccccccccccccccccccccccc",
  "runId": null,
  "policyHash": "bbbbbbbbbbbbbbbbbbbbbbbbbbbbbbbbbbbbbbbbbbbbbbbbbbbbbbbbbbbbbbbb",
  "target": {
    "resourceType": "feedback",
    "resourceId": "83000000-0000-4000-8000-000000000001",
    "sourceId": "11111111-1111-4111-8111-111111111111",
    "sourceVersion": "sha256:68fc3e599c5dcb5523a2d65c2d9586bfbec34d8b0dae0660659cf8b965533b13"
  },
  "requestSummary": { "decision": "request-revalidation" },
  "resultSummary": { "feedbackEvidenceId": "83000000-0000-4000-8000-000000000002" },
  "errorCode": null,
  "integrity": {
    "hashAlgorithm": "sha256-jcs",
    "payloadSha256": "49660aabbe6bcaa9d0b284f29d9ea28bf0d6154dd0ecffcb8985b5f078e0e2d4",
    "previousEventSha256": "5c1e1ce4611b79d9fb95699d8867bf1a324a502e4da862b457b7a5c278da924a"
  }
}
